,documents,document_scores,document_ids
11,"In the dining room's soft amber glow, dozens of patrons peruse the menu at Rock Creek restaurant in Bethesda, Maryland. From a health standpoint, making a smart choice is easy. Watch your portion size and inquire about the nutritional content of your meal when you eat out. Whether it's the slow-cooked salmon with sesame seeds, warm bok choy salad, and miso mustard dressing or the jumbo lump crab cakes with celeriac-apple slaw and lemon-caper aioli, each meal contains 600 or fewer calories -- nearly half the amount found in a typical restaurant entree. ""We offer what you're supposed to eat -- proper portions, great flavor-and we use fresh, local ingredients as much as possible,"" says co-owner Tom Williams, who, with partner Judith Hammerschmidt, opened Rock Creek two years ago. The pair worked with Cynthia Payne Moore, R.D., a Baltimore, Maryland-based dietitian, to obtain nutritional analyses for every item on the menu, and they adjust recipes to avoid unnecessary fat and determine portion sizes.   ""We put the nutritional information in the back of the menu-people who want to look at it do, and those who don't, don't,"" Hammerschmidt says.   The concept and execution have proved so successful that earlier this year, the pair opened another Rock Creek in Washington, D.C. Enjoying restaurant food like Rock Creek's -- tasty, good for you, and with a reasonable amount of calories -- was once a difficult order to fill. No longer.   ""The idea that eating healthy doesn't mean feeling deprived is something restaurants see as a vehicle for change, as a way to differentiate their offerings from their competitors,"" says Master Chef Mark Erickson, vice president for continuing education at the Culinary Institute of America.   While some restaurants make it clear they offer more healthful fare -- by using symbols, calorie counts, and the like -- others practice what Erickson calls ""stealth health,"" making some healthful changes on the menu without fanfare. ""When restaurants make their menus more healthful, consumers benefit,"" Erickson says. And, in fact, eating well when dining out is a growing trend. Healthfulness on the menu . Part of what's driving these positive changes is consumer demand. Nearly three out of four adults say they are trying to make healthier choices when eating out than they did just two years ago, according to the National Restaurant Association.   ""It's hard to refute that health is related to diet,"" Erickson says. ""And restaurants are making up more and more of the daily diet -- the average American eats one out of three meals away from home."" Increasingly, savvy consumers expect restaurants to have a conscious approach to food preparation similar to the one they use in their own kitchens -- using fruits and vegetables creatively or cooking with less saturated fat or salt. CookingLight.com: Secrets to eating out . Legislative changes are also having an effect. The New York City-initiated ban on trans fats has become far-reaching; at least eight other major metropolitan areas have legislated similar bans, as have restaurants, hotels, theme parks, cruise lines, and many other businesses.   Meanwhile, New York City recently took another stand on upgrading restaurant menus. In a move affecting mostly fast-food restaurants, the city's board of health recently asked food service establishments with standardized preparation methods that already have nutrition analyses to post calorie information on menus so customers can see it when deciding what to order. Many restaurants purposefully take their offerings to a more healthful level. Since he took over the kitchen at the highly regarded Gramercy Tavern in New York City last October, Executive Chef Michael Anthony has created lighter dishes, many of which feature vegetables rather than meat as the plate's centerpiece. ""The goal is to leave consumers feeling invigorated, not lethargic because they've overindulged,"" Anthony says. Like Rock Creek, some restaurants are building their business around a more healthful model. Seasons 52, which has five locations in Florida and two in Atlanta, Georgia, takes a lighter approach to dining by featuring fresh foods that rotate with the seasons and dishes that contain a maximum of 475 calories.   The chefs do this by taking out fat, lowering sugar and salt when possible, and relying instead on flavorful accents such as balsamic vinegar, lemon juice, garlic, and fruits. ""We call it 'palate distraction,'"" explains Clifford Pleau, director of culinary development. ""If you can give the mouth something else to focus on, it says, 'Wow! I haven't tasted something that interesting before,' instead of 'Wow! Something's missing.'"" CookingLight.com: An expert take on healthful dining-out trends . Tap into the trend . ""While restaurants are becoming more health-conscious, it's only going to keep happening if people ask for it,"" says Katherine Tallmadge, R.D., a Washington, D.C.-based spokesperson for the American Dietetic Association. Here's how to support the trend while ordering sensibly: . • Do a little homework. ""If you decide ahead of time what you want to order, it will eliminate temptation while you are at the restaurant,"" Tallmadge says. Many national chains post nutrition analyses on their Web sites, so you can find out how much fat, cholesterol, sodium, protein, carbohydrates, fiber, and calories a potential meal contains. Healthydiningfinder.com, a Web site operated by the National Restaurant Association, can help you pinpoint nutritious fare at nearly 30,000 restaurants across the country -- enter your ZIP code or your city, and you can search for restaurants by cuisine or price range. • Watch portion size. Prodigious entrees remain common in many restaurants, despite other changes for the better. Because patrons tend to place a premium on value -- they want to feel as if they're getting their money's worth -- piled-high plates aren't likely to become a relic of the past anytime soon.   ""You can negotiate such situations by having part of your meal boxed to take home, downsizing your order by selecting an appetizer and side salad instead of an entree, or splitting the entree with someone,"" says Dawn Jackson Blatner, R.D., a Chicago, Illinois-based ADA spokesperson. CookingLight.com: How to practice portion control . • Sample small plates. Tapas-sized servings -- i.e. small plates -- will continue to be in fashion in coming years, according to Restaurant Startup Consultants, Inc., which counsels new food service businesses. Small plates allow you to sample a variety of dishes without consuming too many calories. In addition to high-end restaurants, the trend is also appearing in some national chains. In March, TGI Friday's unveiled a new Right Portion, Right Price menu, offering smaller portions of certain entrees that contain 500 calories or less and 10 grams of fat or less per serving. CookingLight.com: Tapas at home . • Choose seasonal ingredients. A less-is-more approach governs the preparation of fresh, seasonal ingredients: They're often minimally dressed or sauced, allowing fresh flavors to play the starring role. Look for items like spinach and roasted beet salad or roasted butternut squash on fall menus.   ""If you have a high-quality meat, fish, or vegetable that has a great deal of flavor, you don't need to eat a lot of it to feel satisfied,"" says Hugo Matheson, chef-owner of the Kitchen Café, who practices this principle at his Boulder, Colorado, restaurant. CookingLight.com: Ultimate summer cookbook . • Select healthful sides. These days, healthful sides, ranging from steamed broccoli to grilled asparagus to sautéed spinach with garlic, have more space on restaurant menus. ""The idea that you can have an indulgent entree but improve your sides is something I enjoy because it's a small change,"" Blatner says. ""If you make small steps to improve what you eat, you'll be healthier for it."" • Look for balance. Chefs and restaurateurs are reexamining the fundamentals of their offerings. At Seasons 52, for example, each entree plate is made up of one-third protein and two-thirds fruits, vegetables, and starches. Others are practicing what the Culinary Institute refers to as ""the protein flip.""   ""Finer dining establishments are flipping the traditional plating concept. Vegetables and carbohydrates are the main component, and protein is secondary,"" Erickson says. • Ask questions. When ordering, inquire about the meal's composition or preparation. ""Go to restaurants where the people serving the food know what the ingredients are,"" Pleau says. For example, Rock Creek uses phyllo instead of traditional lard-laced dough in its piecrusts; but unless you ask them, you won't know that you can enjoy a slice of their pie and avoid unnecessary saturated fat and calories. • Enjoy yourself. While we're all eating out more often these days, consider a restaurant meal to be a treat. Savor the flavors, and select dishes you can't or wouldn't make in your own kitchen. ""Look at the meal as a source of pleasure,"" Anthony says. ""The key is to relish the experience -- within moderation."" For more tips on making healthy taste great, try Cooking Light - CLICK HERE . Copyright 2009 Cooking Light magazine. All rights reserved.",0.6536444,4327
12,"NEW YORK (CNN) -- New York's iconic Plaza Hotel will lose a figure nearly as synonymous with it as Eloise when its longest-serving doorman retires Thursday after 46 years on the job. Ed Trinka, whose retirement coincides with his 65th birthday, joined the hotel 1963. Ed Trinka, whose retirement coincides with his 65th birthday, joined the hotel's staff in 1963 as a teenager. He spent 40 years at the fabled lodging's Fifth Avenue entrance, relocating to its doorway facing Central Park South during the property's renovation and partial conversion to condominiums several years ago. Now as much a Central Park South fixture as the horse-drawn carriages that line the park's southern perimeter, the gregarious Trinka is known as the ""mayor of 59th Street."" On a recent afternoon, he seemed to know every other passerby, exchanging a constant stream of hellos with chauffeurs and doormen from adjacent tony apartment buildings and, of course, the Plaza's residents. Over his more than four decades manning the Plaza's entrance, Trinka has met countless celebrities -- or ""all of them,"" as he puts it. After his first celebrity encounter at the hotel with the Beatles, he's catered to a long procession of big names, including Joe DiMaggio, Jacqueline Kennedy Onassis and Liza Minnelli. Marla Maples, ex-wife of one-time Plaza owner Donald Trump, would regularly peck Trinka on the cheek when she saw him. Trinka says he has an autographed photo of Richard Nixon -- a token of gratitude from the former president -- hanging on proud display at his home. Trinka says he has thoroughly enjoyed his lengthy stay at the portal to history and glamour. ""I never had a bad day in all the years."" Nonetheless, with all those years at the hotel under his belt, Trinka felt it was time to ""bow out gracefully."" As he transitions to retirement, Trinka says he'll miss the front-row view of Central Park and the hotel's clientele -- the ""greatest people in the world."" He also concedes he'll miss ""the women."" The building's inhabitants are not eager for his departure. ""He's a gentleman, refined -- you don't find these people anymore,"" lamented resident Joan Spain. Trinka's replacement, Jimmy O'Connell, is keenly aware of the large shoes he'll have to fill, saying he'd be satisfied if he ""could be half the doorman"" Trinka is. The hotel will bid farewell to Trinka in characteristically grand fashion on Thursday afternoon. After a champagne send-off in the hotel's landmarked Oak Room, its management will present him with an opportunity to view the Plaza from the vantage point of the countless guests he's greeted over the years: He'll be given a free stay at the hotel. In addition to a trove of anecdotes about celebrities, Trinka acquired something else during his tenure at the Plaza: a new name. Years ago, the hotel gave him a nametag that mistakenly read Edward, even though his full name is Edwin. He came to embrace the errant nametag, neglecting to correct people when they called him Edward and even naming his own son Edward.",0.6255981,3553
13,"(CNN) -- Denny's restaurants served about 2 million free Grand Slam breakfasts during its eight-hour promotional giveaway on Tuesday, the company reported Wednesday. Cooks fill the pass-through window with Grand Slam breakfasts Tuesday at a Denny's in Emeryville, California. The company used a commercial during the third quarter of Sunday's Super Bowl to announce it would give away its signature breakfast from 6 a.m. to 2 p.m. Tuesday, and the response was spectacular. Media outlets across North America reported lines of customers stretching outside and around restaurants and strangers crowding together into booths to take advantage of the special. The restaurant chain's approximately 1,500 stores served an average of 130 Grand Slams per hour to customers who waited an average of 60 minutes for their free pancakes, eggs, bacon and sausage, the company said. ""We had an extraordinary day,"" Denny's CEO Nelson Marchioli said when the promotion was over. ""We were hoping to reconnect with millions of Americans today, and we did. ""We have received the most heartwarming comments from our servers, our managers and above all our customers. This Free Slam Day has exceeded our expectations in every way."" iReport.com: Miami customers line up for Denny's meal . Denny's doesn't disclose specific cost information, but including the cost of the food, the Super Bowl spot and other production costs, the promotion cost the company roughly $5 million, it said. The Grand Slam started as a baseball-related promotion in Atlanta, Georgia, in the mid-1970s and has been served chainwide since 1977. Its normal price varies by market but averages around $5.99. Denny's said it sells 12.5 million Grand Slams a year. At the normal average price of $5.99, Denny's gave away meals Tuesday with a retail value of $11.9 million. But the goodwill value could be priceless. iReport.com: Vouchers run out at Georgia Denny's . ""The key is to get the guest to come back,"" Troy Morgan, a Denny's franchisee in Sacramento, California, told CNN affiliate KCRA-TV. ""So, we show them great hospitality and we're confident we're going to win guests and get them to return again and again."" A Denny's competitor, IHOP, is planning its own giveaway. The chain promises to give a short stack of three pancakes to all comers on ""National Pancake Day,"" February 24. IHOP requests a donation to Children's Miracle Network or other local charities in exchange.",0.62181556,9731
14,"(Mental Floss) -- It's hard to walk down the aisle of a liquor store without running across a bottle bearing someone's name. A costumed reveler at a Captain Morgan party celebrates the rum named after the 17th century privateer. We put them in our cocktails, but how well do we know them? Here's some biographical detail on the men behind your favorite tipples: . 1. Captain Morgan . The Captain wasn't always just the choice of sorority girls looking to blend spiced rum with Diet Coke; in the 17th century he was a feared privateer. Not only did the Welsh pirate marry his own cousin, he ran risky missions for the governor of Jamaica, including capturing some Spanish prisoners in Cuba and sacking Port-au-Prince in Haiti. He then plundered the Cuban coast before holding for ransom the entire city of Portobelo, Panama. He later looted and burned Panama City, but his pillaging career came to an end when Spain and England signed a peace treaty in 1671. Instead of getting in trouble for his high-seas antics, Morgan received knighthood and became the lieutenant governor of Jamaica. Mental Floss: 5 drinking stories that put yours to shame . 2. Johnnie Walker . Walker, the name behind the world's most popular brand of Scotch whisky, was born in 1805 in Ayrshire, Scotland. When his father died in 1819, Johnnie inherited a trust of a little over 400 pounds, which the trustees invested in a grocery store. Walker became a very successful grocer in the town of Kilmarnock and even sold a whisky, Walker's Kilmarnock Whisky. Johnnie's son Alexander was the one who actually turned the family into famous whisky men, though. Alexander had spent time in Glasgow learning how to blend teas, but he eventually returned to Kilmarnock to take over the grocery from his father. Alexander turned his blending expertise to whisky, and came up with ""Old Highland Whisky,"" which later became Johnnie Walker Black Label. 3. Jack Daniel . Jasper Newton ""Jack"" Daniel of Tennessee whiskey fame was the descendant of Welsh settlers who came to the United States in the early 19th century. He was born in 1846 or 1850 and was one of 13 children. By 1866 he was distilling whiskey in Lynchburg, Tennessee. Unfortunately for the distiller, he had a bit of a temper. One morning in 1911 Daniel showed up for work early and couldn't get his safe open. He flew off the handle and kicked the offending strongbox. The kick was so ferocious that Daniel injured his toe, which then became infected. The infection soon became the blood poisoning that killed the whiskey mogul. Curious about why your bottle of J.D. also has Lem Motlow listed as the distillery's proprietor? Daniel's own busy life of distilling and safe-kicking kept him from ever finding a wife and siring an heir, so in 1907 he gave the distillery to his beloved nephew Lem Motlow, who had come to work for him as a bookkeeper. Mental Floss: The many myths of Jack Daniel . 4. Jose Cuervo . In 1758, Jose Antonio de Cuervo received a land grant from the King of Spain to start an agave farm in the Jalisco region of Mexico. Jose used his agave plants to make mescal, a popular Mexican liquor. In 1795, King Carlos IV gave the land grant to Cuervo's descendant Jose Maria Guadalupe de Cuervo. Carlos IV also granted the Cuervo family the first license to commercially make tequila, so they built a larger factory on the existing land. The family started packaging their wares in individual bottles in 1880, and in 1900 the booze started going by the brand name Jose Cuervo. The brand is still under the leadership of the original Jose Cuervo's family; current boss Juan-Domingo Beckmann is the sixth generation of Cuervo ancestors to run the company. 5. Jim Beam . Jim Beam, the namesake of the world's best-selling bourbon whiskey, didn't actually start the distillery that now bears his name. His great-grandfather Jacob Beam opened the distillery in 1788 and started selling his first barrels of whiskey in 1795. In those days, the whiskey went by the less-catchy moniker of ""Old Tub."" Jacob Beam handed down the distillery to his son David Beam, who in turn passed it along to his son David M. Beam, who eventually handed the operation off to his son, Colonel James Beauregard Beam, in 1894. Although he was only 30 years old when he took over the family business, Jim Beam ran the distillery until Prohibition shut him down. Following repeal in 1933, Jim quickly built a distillery and began resurrecting the Old Tub brand, but he also added something new to the company's portfolio: a bourbon simply called Jim Beam. Mental Floss: A bourbon FAQ . 6. Tanqueray . When he was a young boy, Charles Tanqueray's path through life seemed pretty clear. He was the product of three straight generations of Bedfordshire clergymen, so it must have seemed natural to assume that he would take up the cloth himself. Wrong. Instead, he started distilling gin in 1830 in a little plant in London's Bloomsbury district. By 1847, he was shipping his gin to colonies around the British Empire, where many plantation owners and troops had developed a taste for Tanqueray and tonic. 7. Campari . Gaspare Campari found his calling quickly. By the time he was 14, he had risen to become a master drink mixer in Turin, Italy, and in this capacity he started dabbling with a recipe for an aperitif. When he eventually settled on the perfect mixture, his concoction had over 60 ingredients. In 1860, he founded Gruppo Campari to make his trademark bitters in Milan. Like Colonel Sanders' spice blend, the recipe for Campari is a closely guarded secret supposedly known by only the acting Gruppo Campari chairman, who works with a tiny group of employees to make the concentrate with which alcohol and water are infused to get Campari. The drink is still made from Gaspare Campari's recipe, though, which includes quinine, orange peel, rhubarb, and countless other flavorings. For more mental_floss articles, visit mentalfloss.com . Entire contents of this article copyright, Mental Floss LLC. All rights reserved.",0.61857444,1344
16,"LONDON, England (CNN) -- A Scottish fish and chip shop visited by Prince William, Robert De Niro and Tom Hanks has been crowned the best place in Britain to eat the national dish. Robert and Alison Smith, the owners of the Anstrhuther Fishbar  in Fife, celebrate their success. The UK is in recession, but the nation's traditional takeaway dish is showing no sign of a downturn. Sales rose at 9,500 chippies in Britain by 1.7 percent last year, according to Seafish, a seafood industry group. The Anstrhuther Fishbar in Fife, Scotland was crowned the best chippy of 2008 following a rigorous selection procedure that included a customer vote, taste tests and two intense rounds of shop inspections. ""Fish and chip shops are well-placed to prosper in the current economic climate as they offer value for money and a quality product with a feel-good factor,"" competition judge Andy Gray said. ""Despite the credit crunch, people still want to enjoy small luxuries. Fish and chips are a national institution which have survived the test of time and will be around for many years to come."" Fishbar owner Robert Smith said that the start of 2009 had been the busiest January since the harbor front shop opened in 2003. Smith, who also owns a fish processing business, said dedication was the key to the shop's success. ""We are passionate about our business and we just do it right,"" he said. Fish and chips is the most popular hot takeaway in Britain, with 276 million meals eaten every year, according to Seafish figures.",0.60988545,2199
