,documents,document_scores,document_ids
29,"If you're like us, you eat out more than ever -- and, as nice as it is to not have to cook, those meals out can actually feel like work. How do you navigate the minefields of huge portions, hidden fats, and sky-high sodium levels? Olive Garden's Venetian Apricot Chicken has 448 calories and 11 grams of fat. You shouldn't have to resign yourself to paying for restaurant meals with a future cardiac risk. You just need to know where to go to find healthy, fresh food. To that end, we went out into the world of sit-down restaurants, looking to separate the (whole) wheat from the chaff. Backed by an advisory panel of experts in healthy dining, we sifted through 43 chains with more than 75 locations across the country and, frankly, were astonished by how many restaurants made no nutritional information available. Health.com: Meet Health's experts . But judge we did those brave (and progressive) enough to share their numbers. What you hold in your hands are the 10 that stood at the top of the heap. Uno's Chicago Grill . If you haven't been to your local Uno's recently, you're in for a great surprise. Sure, its famous deep-dish (read high-fat) pizzas still hold court, but nutrition has become the word of the day with a completely transfat-free menu and plenty of grilled entrees (including antibiotic-free chicken). Adding to the healthy variety: whole-grain pasta and brown rice, organic coffee and tea, and flatbread pizzas that have half the calories of deep-dish ones. Plus, you can add a salad to your pizza for half-price because, according to the menu, ""We want you to get some greens in your diet."" Now that's a blue-ribbon commitment to health. Another reason Uno's is at the top of our list: You know what you're eating. In the lobbies of most of the restaurant's locations, there are Nutrition Information Centers that detail ingredients, fat and sodium contents, and calories and fiber of every item, in addition to gluten-free options.  Dr. Sanjay Gupta takes a look at Health magazine's restaurant choices » . • Danger zone: Deep-dish pizzas can pile on the fat. • We love: The Penne Bolognese -- just 16 grams of fat (well within the daily recommended max of 65 grams of fat for a 2,000-calorie-a-day diet). Souplantation & Sweet Tomatoes . Can a buffet-style restaurant -- that symbol of American overindulgence --possibly be one of the healthiest restaurants in the country? It can in this case, because this salad-soup-and-bakery eatery (Southern California locations are named Souplantation, everywhere else they're called Sweet Tomatoes) uses produce so fresh that it's guaranteed to have been ""in the ground"" 24 hours before it's in a refrigerated truck on its way to the restaurant. At the salad bar you'll find seasonal vegetables like squash and bell peppers, freshly tossed and prepared salads, and a great range of nonfat dressings. San Marino Spinach With Pumpkin Seeds and Cranberries, anyone? This is paradise for vegetarians, vegans, and anyone who's looking for a low-sodium, low-fat, high-nutrient meal outside the home. • Danger zone: Plate overload -- after all, it's all-you-can-eat. • We love: The Tomato Spinach Whole Wheat pasta, a delicious combo of whole grains and veggies. Mimi's Cafe . This cozy café-style restaurant transforms normally less-than-healthy foods into better -- and still tasty -- options: a half-pound cheeseburger wrapped in lettuce (that's right, no bun); the cutely named Naked French Market Onion Soup, served without cheese. Another thing to love is the way that Mimi's clearly steers you toward its healthy options. Its ""Lifestyle Menu"" points you to low-carb picks like the fish of the day served with fresh steamed veggies. Also, Mimi's keeps portions small, so you can get away with occasionally having one of their more indulgent entrees like the Sweet & Sour Coconut Shrimp (608 calories). Health.com: Healthiest fast-food restaurants . • Danger zone: The ""Comfort Classics"" page of the menu, with throwbacks like rich (super-high-fat) Chicken Cordon Bleu. • We love: Chicken & Fruit -- grilled chicken and a garden salad, plus wedges of fresh orange, honeydew, watermelon, and cantaloupe. P.F. Chang's China Bistro . Take the best aspects of Asian cuisine -- a combination of fresh vegetables and protein -- surround them with healthy influences such as whole-grain brown rice, wild-caught, sustainable Alaskan salmon, and all-natural chicken, and you have a recipe for delicious, healthy dining. Wok-based cooking (which requires less oil) using soybean oil keeps fat contents low, and less sodium in the sauces rounds out  P.F. Chang's healthy take on Chinese food. Special credit goes to their nutritional information being based on the whole entrée, not a single serving like at most places. Health.com: Eat out, without gaining a pound . • Danger zone: Traditional, fat-dense items such as Lo Mein Beef. • We love: Carb-free vegetarian lettuce wraps -- wok-seared tofu, red onions, and water chestnuts with mint and lime, set in lettuce cups. Bob Evans Restaurants . You wouldn't think a restaurant that prides itself on sausage could muscle its way into the top five healthiest restaurants in the country. But Bob Evans scores high on its dinner menu, which has plenty of low-carb, low-fat entrees and alternatives for children and adults (chicken tenders that are grilled instead of fried, potato-crusted flounder, and salmon stir-fry). Look for sides like steamed broccoli florets and fresh fruit, and enjoy old-fashioned family meals in a modern, nutrition-forward way. • Danger zone: Breakfast, where bacon and sausage are kings. • We love: Healthy options on the kid's menu, like slow-roasted turkey with mashed potatoes and glazed baby carrots, and fruit and yogurt dippers for dessert. Ruby Tuesday . If we'd done this survey in 2004, Ruby Tuesday might have won the blue ribbon for printing all its nutritional content right on the menu. It was revolutionary, and, frankly, it didn't last. But the healthy ethos survived in the chain's ingredients: organic greens, hormone-free chicken, transfat-free frying oil, and better-for-you beverages including Jones organic teas and made-to-order drinks like all natural lemonades (think real fruit and juice). It's easy to find the good stuff -- it's highlighted -- and the offerings range from a chicken wrap in a whole-wheat tortilla to broiled tilapia. Health.com: The best independent restaurants . • Danger zone: Comfort-food entrees like Gourmet Chicken Potpie, which piles more than half your daily calories on the plate. • We love: That they've even healthied-up the burgers, offering veggie-and turkey-versions. Romano's Macaroni Grill . This Italian eatery puts its entire menu's nutritional content online, so you know before you go what to steer clear of -- mainly, the massive baked pastas. But what pushed Macaroni Grill onto our best list is its ""Sensible Fare"" menu, with entrees like Simple Salmon, a grilled fillet sided by grilled asparagus and broccoli. Grazie for whole-wheat penne available as a substitute in any dish. And bravo for including a grilled skinless chicken breast with steamed broccoli and pasta on the kid's menu. • Danger zone: Heavy entrees like spaghetti and meatballs with meat sauce. • We love: The delicious Italian sorbetto and biscotti: just 330 calories and 4 grams of fat. Chevy's Fresh Mex . Chevy's makes a big deal out of the ""fresh"" in its name, and with good reason -- no cans in the restaurant, fresh salsa blended every hour, fresh avocados smashed every day for guacamole, and watch-them-made tortillas. All oils are trans fat-free, and the Mexican-style fare has lots of healthy options including Grilled Fish Tacos. Health.com: America's not-so-healthiest restaurants . • Danger zone: Sodium counts. To get below 1,000 milligrams, you'll need to get those Chicken Fajitas with no tortillas, tomalito, rice, sour cream, or guacamole. • We love: Fresh fish of the day, grilled and served on a skillet with homemade salsa. Olive Garden . Like Macaroni Grill, this Italian eatery has great-for-you options, as long as you keep your wits about you (again, avoid the baked pastas!). Use the olive-branch icon on the menu to find low-fat ""Garden Fare"" items such as Venetian Apricot Chicken. Even the fries aren't a disaster, because they're done in trans fat-free oil. You can grab some whole-grain goodness, too, by choosing the whole-wheat linguine at dinner as a substitute for any pasta. • Danger zone: The non-olive-branch entrees. Olive Garden provides no nutritional information on anything else on the menu. • We love: The low-fat Capellini Pomodoro (644 calories and 14 grams fat). Denny's . Yes, the home of the Lumberjack Slam and Moons Over My Hammy offers lots of skinny options to counter its fatty mainstays. ""Fit-Fare"" dishes such as the grilled-chicken-breast salad, and tilapia with rice and veggies, each have less than 15 grams of fat. Denny's also posts full nutritional information on its Web site. Its use of trans fats to cook its French fries kept it from landing higher on our list, but the rest of the fried food is trans fat-free. • Danger zone: Breakfast specials, especially the Meat Lover's Scramble, which is as bad for you as it sounds. • We love: The online nutritional chart has Weight Watchers Food Exchange Values. E-mail to a friend . Enter to win a monthly Room Makeover Giveaway from MyHomeIdeas.com . Copyright Health Magazine 2007 . Additional reporting by Brittani Tingle.",0.5546422,497
30,"Editor's note: CNN Contributor Bob Greene is a best-selling author whose new book is ""Late Edition: A Love Story."" Bob Greene says ordinary life stops when Muhammad Ali appears anywhere. (CNN) -- It was still early enough in the evening that the main dinner crowd had not yet started to show up; the restaurant, east of Michigan Avenue in Chicago, was less than half-filled. The party of 10 at the table by the front window had arrived promptly for their 6 p.m. reservation. Nine of the 10 studied their menus, but the 10th, the man at the head of the table, did not. Muhammad Ali, 67, stared down toward the white tablecloth and drew on a piece of paper. He sketched a picture of a mountain. There are a handful of men among us who, simply by appearing out of nowhere, make other men and women pause involuntarily to consider the long paths of their own lives. It is as if these men have always been with us, and if you should unexpectedly spot Bob Dylan in an airport, if you should see Paul McCartney walking through a hotel lobby, if you should encounter Sean Connery entering an office building, it will bring you up short. It's like opening a diary, even if you have never met them, even if you have never seen them except on a television set or a movie screen. Yet Ali is different even from them. Ali -- his story so complicated, his health failing, his imprint on the world so indelible -- makes people mist up the moment they lay eyes on him. It was happening tonight inside this restaurant called the Rosebud Steakhouse; diners at their own tables, not quite sure for a second that they were really seeing what they were seeing, let their gazes linger and could not look away. Ali drew. The other men and women at his table -- this was a gathering of family and friends to celebrate a birthday, and Ali had come into Chicago from his farm in Michigan -- talked animatedly and laughed. Ali did not speak. He wore a blue-and-white Hawaiian-style shirt; someone had tucked a white napkin into the space above the top button. Over the speaker system of the restaurant, a slowed-down acoustic knockoff of the old Tom Petty hit ""Free Fallin' "" was playing softly: . ""She's a good girl, crazy 'bout Elvis ..."" A family, across the way, talked spiritedly among themselves. They were deciding something. The father and the children stood up. From the ceiling, the song: . ""... and I'm free, free fallin' ..."" They walked over to Ali's table. ""We apologize for the intrusion,"" the father said. Ali looked toward them, showing a gentle expression. The father had a camera. He said to his children: ""This is the most famous face in the world."" It is difficult to know what the children made of this. Youth and strength and beauty are so fleeting. The man in the Hawaiian shirt once embodied all of those things, before these children were born. Three times the world heavyweight boxing champion, the center of global fascination and frenzied controversy after winning his first title and then changing his name from Cassius Clay, endlessly mesmerizing with his float-like-a-butterfly, sting-like-a-bee ring style, called ""the greatest of all time"" so often that the words became almost an official designation, the sight of his flawless face and the sound of his confident-beyond-all-dispute voice a sustaining part of the very atmosphere. ... But his road has turned hard, and here were these children, who were not around for any of that, standing with their father next to the table. Ali's family members and friends said it would be all right for the father to take some photos, so he did. When he left, Ali went back to his drawing. More diners were beginning to arrive at the restaurant. Their evenings changed the moment they caught sight of him. Some pulled out cell phones to call people across the nation; others quietly debated whether to approach him. Many years ago, I traveled the country with him to prepare a magazine profile for a special issue on the 50 men and women judged to have had the greatest impact on society during their time on Earth. Everywhere Ali went, he was mobbed; people grabbed at him, people cried out, people attempted to touch his face. In the middle of all this one day, he said to me, almost in a whisper: . ""This is the whole world. This is what my whole life is like."" That hasn't changed, although his ability to speak aloud about it has. The food began to arrive at his table. The people to his right and to his left helped him with his. He demonstrated not the least sliver of self-consciousness; this is part of his life now, and he knows how much he is loved. He handed something to a man named Cleve Walker, who has been his friend for 50 years. It was a drawing that a young girl had brought over to him earlier. She had made a picture of a butterfly and had presented it to him. Now Ali gave it to Walker, who took it across the restaurant to where the child was sitting with her family. Ali had signed his name to it. Walker handed it to the little girl. Her face lit up. Outside the restaurant, on Walton Street, a group of young men walked by, wearing officially licensed jerseys bearing the names and uniform numbers of their favorite current-day sports stars. One of the young men glanced through the windowpane but did not register that the man at whom he was looking was Ali. Ali studied the tablecloth, and a birthday cake arrived, and the others at the table began to sing in the direction of one woman among them: . ""Happy birthday to you, happy birthday to you ..."" Ali did not sing nor did he look up. But then the others reached the penultimate line of the song: . ""Happy birthday, dear Marilyn ..."" And with that Ali lifted his head and gazed directly at her, right into her eyes, and smiled the most luminous smile toward her. ""... happy birthday to you."" Soon they rose to depart. Some in the restaurant, now more crowded, applauded. Ali did not react. And then he was out on the street and in a moment out of sight. Around the next corner, although they did not yet know it, people would soon be stopping in their tracks. He may be the only one who remembers his life when it was any other way. The opinions expressed in this commentary are solely those of Bob Greene.",0.55267817,6738
31,"IN THE FLORIDA KEYS (CNN) -- In the early morning darkness of the Florida Keys, the low hum of the Mystic I is hardly enough to disturb the slumber of the tourists in their hotel rooms. A lobster fisherman holds two spiny tail lobsters caught during the Mystic I's trip off the Florida Keys. From the wheelhouse, Captain Karl Lessard steers his boat into the darkness toward the fertile fishing grounds off the small Island of Marathon, Florida. This is a ritual that Lessard has done thousands of times. ""I've been fishing for 38 years, my family has been fishing since the 1820s, there are a lot of fourth-, fifth- and sixth-generation fishermen that are here in the Keys,"" Lessard says. At dawn he reaches a spot that holds a special meaning for him. ""I pass where my mother's and father's ashes are scattered. Just around sunrise, it's a very spiritual place for me."" In the light of a spectacular sunrise, Lessard plots his course on the open waters. ""I fish for the freedom,"" he explains. ""It's good for the soul. It's a fantastic way to make a living, coming out here in God's glory every day."" He adds with a laugh that fishing also ""gets me away from the house. I hate those 'honey-do's.' "" It's spiny tail lobster season in the Florida Keys, and that is what Captain Karl and his three-man crew are on a quest for today. ""I am hoping to catch between 300 and 400 pounds, with the new moon that slows fishing down,"" the skipper says. They travel 20 miles offshore to where they have put out their traps. They hope to find them filled with the clawless crustaceans that live in these shallow waters. ""In the Keys, people really started fishing for lobster in the 1930s,"" Lessard says. ""Before that there was very little market for them."" Lobster fishermen in years past worried more about the impact of things like hurricanes, but these days they have other concerns, namely the price they can get for their catch. ""This ... economy that we are in is not really promoting the sale of our product,"" Lessard says. ""Lobster is going from eight dollars a pound to three dollars a pound. We are basically in survival mode at the present time, but it is still a wonderful way to make a living."" As a mate hooks the buoys and throws the line in the winches, the traps break onto the surface. As they are hoisted on deck the captain smiles at what he is seeing. ""We got some nice lobsters today, some grandes,"" he says.  Watch the skipper at work on the water » . Lessard navigates his boat along his strings of traps as his crew pulls them, repeating the motion some 480 times. Two dolphins play off the bow. ""This is the most beautiful office that anyone could have in the world,"" the lobster fisherman says. ""If you feel the calling, there is no better way to make a living. It's something I've wanted to do since I was a child, and I'm blessed to have been able to do what I wanted to do in life, and have the freedom to do it. ""I hope my family can do it for another hundred years."" As the afternoon wears on, the traps rise out of the ocean and fall back to the seabed, and a constant flow of lobster fills up the boat's holding tanks. The catch seems to be better than expected. ""Sometimes if you are lucky, it's better than being good. And if you're good and lucky, that's even better,"" Lessard jokes. With the last trap dropped back into the water, Lessard and the crew of the Mystic I head back to the dock, where they will place the day's catch onto the scales to see how good the sea has been to them. ""Today we caught 476 pounds. I didn't expect to do this well with the phase of the moon,"" Lessard says. Tomorrow morning the captain will rise again in the darkness and answer the calling that he and his family have heeded for generations. ""My family is out here, and I plan on being out here and joining them someday,"" Lessard says, ""although I would like it to be a long time from now.""",0.5482471,7494
32,"BEIJING, China (CNN)  -- What's in a name? Westerners are more accustomed to names that describe the ingredients and how they are cooked. Local dishes like ""Husband and wife's lung slice"" or ""Chicken without sexual life"" conjure lots of furrowed eyebrows on famished foreigners. So, with the Olympics a few short weeks away, China is giving its cuisine a linguistic makeover. It is proposing that restaurants change the names of exotic, but bizarrely named, delicacies to make them more delectable for the estimated 50,000 visitors arriving in August for the Summer Games. The appetizer ""Husband and wife's lung slice"" is taking on the more appetizing ""Beef and ox tripe in chili sauce."" ""Chicken without sexual life"" has been transformed into ""Steamed pullet."" The government has put down more than 2,000 proposed names in a 170-page book that it has offered to Beijing hotels, according to state media. ""Thanks to the pamphlet, we do not have to struggle to come up with the English translations of dishes any more, which is usually time consuming,"" a senior manager at the four-star Guangzhou Hotel in downtown Beijing told the Xinhua news agency. The Chinese say the names of their dishes focus more on appearance than taste or smell. But Westerners are more accustomed to names that describe the ingredients and how they are cooked -- such as pot roast. The government realizes local names are a matter of taste, but don't want them to get lost in translation. Hence, the spicy Sichuanese dish ""Bean curd made by a pock-marked woman"" has been bestowed the more palatable ""Mapo tofu."" Not everyone is pleased. ""The process of standardizing a menu translation is a double-edged sword,"" wrote columnist Raymond Zhou in the China Daily newspaper. It ""removes the ambiguity and unintended humor"" and ""takes away the fun and the rich connotation. ""It turns a menu into the equivalent of plain rice, which has the necessary nutrients but is devoid of flavor.""",0.5438608,6693
33,"(CNN) -- McDonald's probably won't be exclaiming ""I'm Lovin' It"" in this case. McCurry restaurant owners A.M.S.P Suppiah and his wife Kanageswary Suppiah. In a David-and-Goliath match-up in the world of fast food, McCurry -- a small Indian curry shop in Malaysia -- has won an eight-year legal battle against the hamburger giant. McDonald's claimed that the prefix ""Mc"" in McCurry trampled on its trademark. The country's Federal Court on Tuesday ruled that it didn't. ""We're very relieved -- much, much relieved -- that this eight-year-old saga is finally over,"" said McCurry owner P. Suppiah. ""We're a typical South Asian-Malay cuisine. No way people walking into McCurry can confuse us with McDonald's."" The sparse 24/7 self-service restaurant in the capital, Kuala Lumpur, is popular with blue-collar workers who are drawn to its affordable fare, such as biryani rice and fishhead curry. Its logo: a chicken flashing a thumbs-up. The eatery opened in 1999. McDonald's filed suit two years later. ""We were shocked that such a big giant wants to take us to court,"" Suppiah said. ""We felt that we had nothing in common, because we were not selling any Western fast food."" The hamburger chain, which has 185 restaurants throughout Malaysia, said McCurry was violating the prefix ""Mc"" and that McDonald's had the right to protect it. McCurry, in turn, said the prefix is common and is part of last names all across Europe. Furthermore, it said, the ""Mc"" in McCurry stands for ""Malaysian Chicken Curry."" A lower court ruled in favor of McDonald's, and Suppiah appealed. An appeals court in 2006 overturned that ruling, prompting McDonald's to appeal this time. On Tuesday, the Federal Court -- the highest in the land -- held up the appeals court ruling. McDonald's said it accepts the judgment. ""We respect the finding of the court and beyond that have no further comment,"" said Liam Jeory of McDonald's Asia Pacific, Middle East and Africa region. Suppiah said the ruling means he can now add other McCurry locations, with its slogan: ""Tasty and so Gooood.""",0.53557146,6132
