,documents,document_scores,document_ids
24,"(Mental Floss) -- People have been eating pickles ever since the Mesopotamians started making them way back in 2400 B.C.E. Here are some even more important things you should know about them. Pickles have gotten credit for health and beauty and winning football games. 1. In the Pacific Islands, natives pickle their foods in holes in the ground lined with banana leaves, and use them as food reserves in case of storms. The pickles are so valuable that they've become part of the courting process, helping a man prove he'll be able to provide for a woman. In Fiji, guys can't get a girl without first showing her parents his pickle pits. 2. Cleopatra claimed pickles made her beautiful. (We guess it had more to do with her genes.) 3. The majority of pickle factories in America ferment their pickles in outdoor vats without lids (leaving them subject to insects and bird droppings). But there's a reason. According to food scientists, the sun's direct rays prevent yeast and mold from growing in the brine. Mental Floss: 8 disastrous product names . 4. In the Delta region of Mississippi, Kool-Aid pickles have become ridiculously popular with kids. The recipe's simple: take some dill pickles, cut them in half, and then soak them in super strong Kool-Aid for more than a week. According to the New York Times, the sweet vinegar snacks are known to sell out at fairs and delicatessens, and generally go for $.50 to a $1. 5. Not everyone loves a sweet pickle. In America, dill pickles are twice as popular as the sweet variety. 6. The Department of Agriculture estimates that the average American eats 8.5 lbs of pickles a year. 7. When the Philadelphia Eagles thrashed the Dallas Cowboys in sweltering heat in September 2000, many of the players attributed their win to one thing: guzzling down immense quantities of ice-cold pickle juice. Mental Floss: 31 unbelievable high school mascots . 8. If it weren't for pickles, Christopher Columbus might never have ""discovered"" America. In his famous 1492 voyage, Columbus rationed pickles to his sailors to keep them from getting scurvy. He even grew cucumbers during a pit stop in Haiti to restock for the rest of the voyage. 9. Speaking of people who get credit for discovering America, when he wasn't drawing maps and trying to steal Columbus' thunder, Amerigo Vespucci was a well-known pickle-merchant. 10. Napoleon was also a big fan of pickle power. In fact, he put up the equivalent of $250,000 as a prize to whoever could figure out the best way to pickle and preserve foods for his troops. 11. During the 1893 Chicago World's Fair, H. J. Heinz used pick-shaped pins to lure customers to his out of the way booth. By the end of the fair, he'd given out lots of free food, and over 1,000,000 pickle pins. 12. Berrien Springs, Michigan, has dubbed itself the Christmas Pickle Capital of the World. In early December, they host a parade, led by the Grand Dillmeister, who tosses out fresh pickles to parade watchers. Mental Floss: Curious, bizarre and storied state symbols . For more mental_floss articles, visit mentalfloss.com . Entire contents of this article copyright, Mental Floss LLC. All rights reserved.",0.5851412,8241
25,"(CNN) -- No drawn butter will ever touch Fiona's tail. She's an extremely rare, seven-year-old ""yellow"" lobster. Fiona's colorful hue makes her a one-in-30 million rarity. Fiona belongs to Nathan Nickerson, the owner of Arnold's Lobster and Clam Bar in Eastham, Massachusetts, who has been in the restaurant business for 32 years. The special lobster was caught off the coast of eastern Canada last week by a friend of Nickerson. ""In 57 years in Cape Cod, I have never seen a yellow lobster and I doubt that I will ever see one again,"" he said Thursday. Experts say Fiona's colorful appearance makes her one in 30 million. Fiona's not really yellow, but more of a bright orange, She's not quite the red color your typical lobster looks after it's been cooked. Nickerson has plans for his new ocean-dwelling friend, but it has nothing to do with the boiling pot. He said he'll keep the 1.75-pound crustacean in a viewing tank at his restaurant, hoping to draw in a few extra customers. CNN's Samuel Gardner contributed to this story.",0.58470774,5270
26,"LONDON, England (CNN) -- The ""crime scene cookies"", ""baaji custard"" and ""sponge shafts"" depicted in Oliver Beale's letter of complaint to Virgin Atlantic struck a chord worldwide. Mean cuisine? Airline industry experts insist standards of in-flight food are improving. The missive he sent to Virgin chairman Sir Richard Branson about a meal he received on board a Virgin flight from Mumbai to London in December spread across the web and email with a vengeance. Not only was this a complaint letter par excellence, but it hit upon one of the most emotive subjects of long-haul air travel: the in-flight meal. Read the letter here. ""Food gets everybody going, whether they are sitting at the back end or the front end of the plane,"" says Peter Miller, marketing director at Skytrax, a UK-based aviation research organization. ""Apart from the sheer fact you might be hungry, it is there to alleviate the boredom. Because of that people tend to focus on it more."" But the criticism passengers target at airline food is not always warranted, Miller argues. Skytrax has been tracking airline service for a decade and every year it ranks airlines according to catering in economy, business and first class. Miller acknowledges that there have been cut backs on catering across short-haul flights and a decline in spending on food in long-haul economy. But Skytrax's research has also revealed a general improvement in standards over the last five years. ""We are actually strong supporters of the overall quality that is served up across most airlines in most parts of the world,"" says Miller. Standards have improved firstly as a result of greater competition between airline catering companies, says Miller. What do you think? Are in-flight meals getting better or worse? What was your worse meal? Sound off below. Austrian catering company DO & CO has transformed the food served onboard Austrian Airlines and Turkish Airlines flights. Skytrax reported a 35 percent increase in customer satisfaction for Turkish Airlines since DO & CO was hired in 2007. ""In the last 15-20 years, the industry has focused on lean production. But we believe [airline catering] is not the job of a car manufacturer,"" says Attila Dogudan, CEO of DO & CO. Good quality airline food not only depends on the quality of raw ingredients, he says, but also the intangible elements of good cuisine. ""If you have chefs doing 3,000 filets on the grill, after 300 they lose the passion,"" says Dogudan. To inspire enthusiasm in its kitchens, DO & CO says it employs an unusually high ratio of chefs to work on a greater variety of dishes. They say they also insist on training cabin staff in food service; they replace the dreaded disposable food trays with crockery; and give passengers menus explaining where their fresh, local ingredients come from. Airlines also use food as a marketing tool and improve standards to attract premium customers. Austrian Airlines has won the Skytrax award for Best Business Class Catering for the last two years. As Michael Braun, spokesman at Austrian Airlines says, ""the current situation in the airline industry is tough and costs have to be cut. But the competition is also very tough, so we need something that makes us unique compared to other airlines."" And for Austrian Airlines, one unique selling point is its food. There is an on-board chef on every Austrian Airlines flight who puts the crucial finishing touches on premium-class meals. The airline also offers a ""Vienna coffee house in the air"" and one quarter of flight attendants are trained sommeliers to guide passengers through the extensive wine list. Airlines worldwide also hire celebrity chefs to add prestige to their culinary efforts. British chef, Gordon Ramsay is one of Singapore Airline's ""Culinary Panel""; Juan Amador works with Lufthansa; and United Airlines enlisted the services of U.S. chef Charlie Trotter to inspire its in-flight menu. Chefs help airlines design meals that perform at high altitude. As Michelle Bernstein, Delta's celebrity chef has said, palates weaken in pressurized air cabins, which means dishes need to be made a more flavorful and seasoned than they would be on the ground. Miller at SkyTrax is skeptical about the true benefits a celebrity chef can bring to onboard catering. After all, Gordon Ramsay isn't actually in the cabin sautéing the potatoes. But he does acknowledge that some chefs have influenced a new style of in-flight cuisine. Chef Neil Perry, hired by Qantas in 2003, initiated a move to healthy eating in first and business class. His work has since influenced standards across catering in all classes. Qantas won the Skytrax award for Best Economy Class Catering in 2008 partly as a result of simple enhancements such as the availability of fresh fruit between meals and from the self-serve bar in economy on its A380 aircraft. But as airlines grapple with a deepening recession, can passengers expect treats to vanish from food trays? Across short-haul flights, making cuts is an ""easier game,"" says Miller. Passengers notice it far less if an airline switches a sandwich for a packet of biscuits and a plastic cup of coffee, he says. But on long-haul flights, airlines are restrained in what they can cut. Miller: ""People measure the standard of their flight by the quality of the food or the size of the portion they get. If a meal is cut back too severely they are going to walk away."" How important is food for you on flights? Is it good enough? Sound off below.",0.5842022,3477
27,"(CNN) -- Celebrity chef Bobby Chinn has tried his hand at a number of things. Chinn's face for television: Picking up his Asian TV Award in 2007. English boarding school taught him that food could be an awful experience; Wall Street taught him that creativity was more important than money and a stint as a stand-up comedian taught him that you can't always get it right. Half Chinese, half Egyptian, Chinn's grandmothers were his first introduction to the variety and pleasure that food can bring. While his palate was subdued by the meals he was given at school in England when he was a boy, his meandering route to becoming a chef came some time after attaining a degree in Finance and Economics. Moving to New York after graduating he worked on Wall Street. ""You didn't produce anything at the end of a day and you didn't breathe fresh air, you didn't know what the weather was like outside because you were on the floor of the New York Stock Exchange. It's like the dungeon of capitalism where time and money met,"" he told CNN's Talk Asia. Chinn escaped ""the dungeon"" after a year and a half to the sunny climes of California, but it wasn't to laze around. An addiction to high-octane and challenging environments saw Chinn explore the possibility of being a stand-up comic. ""I was always afraid to talk in front of the class and now I am trying to make them laugh"" he told CNN. ""One day you are really funny and then you go to another gig the same night and nobody laughs and then at the same time you are living a life of poverty. When you are bombing as a comic I don't think there can be a worse life."" While finding out the hard way how funny, or not, he was, Chinn was working front-of-house in restaurants, nurturing his love of food. His break came when Hubert Keller from San Francisco restaurant Fleur de Lys took him on as a volunteer in his kitchen. ""He gave me a job and after one week he said 'OK, you can stay.' And then when you work with one really great chef, then I think you can work anywhere,"" he said. After also training with chefs in France, Chinn made his own mark on the culinary world when he opened his first restaurant in Vietnam in 1995, and at first found the going tough. ""Supplies were not consistent, the language barrier, the taste barrier, the hygiene barriers. Those are very taxing on a person like me with very little patience."" A high-energy chef and now a TV celebrity who presents ""World Café Asia"" -- he won an Asian Television Award in 2007 -- Chinn is aware that being flavor of the month on TV is transitory. ""It is just a machine that feeds on people like me and then spits me out when my time is done. You just have to go with the flow.""",0.56998706,919
28,"(CNN) -- At the stroke of midnight, American beer drinkers were no longer breaking the law when they broke open a beer. Brewers and beer lovers this weekend are toasting the return of legal brew 75 years ago. Breweries and beer lovers around the country are celebrating the 75th anniversary of the return of beer on April 7, 1933, as the Prohibition era was drawing to a close. It wasn't quite the end of Prohibition, and it wasn't quite beer, but after 14 thirsty years, it was close enough. What became available that day was only 3.2 percent alcohol by weight (compared with up to 5 percent in full-strength beer), but still, it was a step up from the virtually alcohol-free ""near beer"" that had been sold since 1920. ""It's a big deal. ... The whole industry of beer has gotten together to say this date is definitely historic,"" said Julia Herz, spokeswoman for the Brewers Association, which represents smaller ""craft"" brewers. In St. Louis, Missouri, megabrewer Anheuser-Busch is throwing a big bash, complete with historical exhibits and an appearance by the company's famous Clydesdale horses. Also in St. Louis, but on a more intimate scale, Schlafly Beer is inviting folks to come out to its Bottleworks for a festival next weekend. Remnants of Prohibition survive today in the form of state-owned liquor stores and local laws that, for example, prevent sales of alcohol on Sundays or in grocery stores. Some counties remain entirely dry, banning alcohol sales altogether, and 3.2 beer is still sold in six states (Colorado, Kansas, Minnesota, Missouri, Oklahoma and Utah), according to Modern Brewery Age magazine. And there are those who think a beer-related anniversary is nothing to celebrate. ""It is the product of choice for underage drinking,"" said Michael Scippa, advocacy director for the Marin Institute, an alcohol industry watchdog group. ""We're not neo-Prohibitionists or teetotalers,"" he said. ""We're not trying to tell adults what to do. "" He said his group just wants the industry to operate more responsibly. The crowds celebrating the anniversary are unlikely to match the size or enthusiasm of those that gathered around breweries all over the country on ""New Beer's Eve,"" April 6, 1933, in anticipation of the return of legal beer that actually had some alcohol in it. ""There was dancing in the streets and lines outside brewery doors ... It was a big date, for sure,"" Herz said. Franklin Delano Roosevelt had been president barely a month, having been sworn in on March 4 after a landslide victory the previous November. Sweeping into power with him was an anti-Prohibition majority in Congress known as ""the wets."" Together they fulfilled their first campaign promise with passage of the Cullen-Harrison Act, which increased the amount of alcohol allowed in beverages from 0.5 percent to a discernible 3.2 percent by weight. When the act took effect at 12:01 a.m. ET April 7, trucks and carriages burst out of brewery gates bearing cases and barrels of beer for a parched republic -- at least for the District of Columbia and the 20 states whose laws permitted it. Several breweries dispatched cases directly to the White House and the Capitol. According to the Brewers Association, more than 1.5 million barrels were snapped up in the first 24 hours. Full-strength beer and hard liquor were still a few months away. National Prohibition wasn't repealed until the 21st Amendment to the Constitution was ratified on December 5. Bob Skilnik, author of eight books about beer, including ""Beer & Food: An American History,"" holds that the December date is more significant and that the quickly brewed April 7 beer probably was of poor quality. ""I know everyone gets excited about it, but you were offered a watered-down version of beer. That's all you got,"" Skilnik said. ""It probably wasn't a very satisfying drink. If you wanted to have a shot [of hard liquor] on the side, you still had to wait until December 5th for that to happen."" But the celebration was about more than getting a buzz. According to a contemporary article in The New York Times, the revival of the brewing industry restored at least 50,000 jobs in the midst of the Great Depression, instantly breathing life into the economies of St. Louis; Milwaukee, Wisconsin; Chicago, Illinois; and other cities and towns where breweries were large employers. ""April 7th was really just ... FDR looking for an economic shot in the arm,"" Skilnik said. ""And it was a very successful shot in the arm. There was a hell of a lot of money spent."" He said $25 million was pumped into breweries and associated businesses -- helping farmers, truckers, and glassmakers as well as brewers and pubs -- in the first 48 hours of sales. And that was good for cash-strapped governments, too. ""Everybody [in government], for the first time, started to wrap their heads around the notion that this is something that you could tax,"" he said. The first day of beer sales reaped $7.5 million in tax receipts for the U.S. Treasury, he noted. About half the nation's breweries went out of business during Prohibition, but others survived by converting to products such as oleomargarine, ice cream, cheese and smoked ham. So at the Storck brewery in Milwaukee, for example, children could enjoy a sundae while Mom or Dad slipped away to a room where illicit beer was served from a hidden tap, according to the American Brewerania Association's Web site. Yes, despite Prohibition, Americans could go for the gusto. Chicago had as many as 20,000 speakeasies, Skilnik said. ""If you couldn't find a beer during Prohibition,"" he said, ""you really weren't trying."" E-mail to a friend .",0.56706345,9816
