,documents,document_scores,document_ids
0,"(Mental Floss) -- 1. The Hamburger -- Louis' Lunch, New Haven, Connecticut . This burger did not come from Louis' so ketchup is OK. There are competing claims for the coveted ""Inventor of the Hamburger"" title, but according to Louis' Lunch (and the Library of Congress, for that matter), this small New Haven restaurant takes the prize. The story goes something like this: One day in 1900, a rushed businessman asked owner Louis Lassen for something quick that he could eat on the run. Lassen cooked up a beef patty, put it between some bread, and sent the man on his way. Pretty modest beginnings for arguably the most popular sandwich of all-time, huh? If you visit Louis' today, you'll find that not much has changed. The Lassen family still owns and operates the restaurant, the burgers are still cooked in ancient gas stoves, and, just like then, there is absolutely no ketchup allowed. 2. The Fried Twinkie -- The ChipShop, Brooklyn, New York . Sometimes what counts isn't being the inventor, it's being the innovator. Take the fried Twinkie, for example. The Twinkie -- in all its indestructible glory-- has been around for ages, but when ChipShop owner Christopher Sell had the brilliant idea to freeze the snack, dip it in batter, and deep-fry it, the Twinkie took gluttony to new heights. Even The New York Times raved about how ""something magical"" happens when you taste the deep-fried Twinkie's ""luscious vanilla flavor."" Sell, who was trained in classical French cuisine, didn't start with the Twinkie, though. In his native England, he fried up everything from M&M's to Mars bars. 3. Root Beer Float -- Myers Avenue Red Soda Co., Cripple Creek, Colorado . If you thought what happened up on Cripple Creek only happened in song, you're sorely mistaken. In August of 1893, a failed gold-miner-turned-soda-company-owner named Frank J. Wisner was drinking a bottle of his Myers Avenue Red root beer while looking up at Cow Mountain. Just then, a full moon illuminated the snowcap on the otherwise black mountain, and Wisner had a brilliant idea -- float a scoop of vanilla ice cream in a glass of his root beer. The new drink was christened the ""black cow"" and became an instant classic. Today, of course, most of us call it a root beer float. 4. Corn Dogs -- Cozy Dog Drive In, Springfield, Illinois . In 1946, Ed Waldmire, Jr., revolutionized the stick-meat world when he debuted the Cozy Dog -- the first corn dog on a stick. At first, he wanted to call his creation the ""Crusty Cur,"" but his wife convinced him to change the name to ""Cozy Dog."" She felt people wouldn't want to eat something described as ""crusty."" Good call, Mrs. Waldmire. Shortly after the Cozy Dog's inception, the Cozy Dog Drive In opened alongside old Route 66 and has been serving up corn dogs ever since. 5. The Pizzeria -- Lombardi's, New York City, New York . Pizza has existed in one form or another for a long time, but America got her first true pizzeria when Gennaro Lombardi opened up a small grocery store in New York City's Little Italy. An employee named Anthony ""Totonno"" Pero started selling pizzas out of the back, and in no time, Lombardi's was concentrating on its burgeoning pizza business instead of plain old groceries. In 1905, the establishment was licensed as a pizzeria, and it's stayed that way ever since. Well, almost. The original restaurant closed in 1984 but reopened down the street 10 years later. On its 100th anniversary in 2005, Lombardi's decided to offer its pizza for the same price it'd been sold for in 1905 -- 5 cents a pie. Needless to say, the line wrapped around the block. 6. Fat Darrell -- R.U. Hungry, New Brunswick, New Jersey . You may not know what the Fat Darrell is, but when you hear what it contains, you'll understand why it's truly a work of inspired genius. Since 1979, Rutgers University has played host to a collection of mobile food vans collectively known as the ""Grease Trucks."" Originally, they served a sandwich called the Fat Cat, which contained two cheeseburger patties, French fries, lettuce, tomato, and onions. Then one night in 1997, a hungry (and broke) student named Darrell W. Butler convinced one of the vendors to put chicken fingers, mozzarella sticks, French fries, and marinara sauce on a sandwich. Strangely, the concoction sounded so appetizing that the next 10 people in line ordered it, and the Fat Darrell became a mainstay at the Grease Trucks. Hey, not any old sandwich gets to be named Maxim magazine's top ""Meat Hog"" sandwich. 7. Philly Cheesesteak -- Pat's King Of Steaks, Philadelphia, Pennsylvania . Philadelphia is known for many things (Ben Franklin, the Liberty Bell, and Rocky, for starters), but fine dining is not really its forte. That's OK, though, because Philly is the home of Pat's King of Steaks, and Pat's King of Steaks is where the Philly cheesesteak was born. One day back in 1932, hot dog stand owners Pasquale (Pat) and Harry Olivieri decided to change things up and make a steak sandwich with onions. A cab driver who ate at Pat's daily insisted on trying the new sandwich, and with the first bite declared, ""Hey, forget 'bout those hot dogs, you should sell these!"" Cab drivers know fast food about as well as anyone, so the brothers did just what the cabbie suggested. In no time, the modest stand turned into the Pat's that exists today. Controversy remains, however, over who's responsible for putting the cheese in cheesesteak. Pat's claims it was the first to do so (in 1951), but across-the-street rival Joe Vento of Geno's Steaks (opened 1966) insists he added the finishing touches. 8. Onion Rings -- Pig Stand, Dallas, Texas . According to most sources, the onion ring was invented when a careless cook at a Pig Stand location in Dallas accidentally dropped an onion slice in some batter, then pulled it out and tossed it in the fryer for lack of a better destination. Now, you'd think inventing the onion ring would be enough for one restaurant chain, but not Pig Stand. The company also lays claim to opening America's first drive-in, inventing Texas toast, and being one of the first restaurants to advertise using neon signs. Not bad for a little outfit from Texas. 9. Derby Pie -- Melrose Inn, Prospect, Kentucky . A Kentucky favorite, derby pie is a chocolate and pecan tart with a pastry-dough crust -- and that's about all we know about it. Why? Because the recipe is jealously guarded by the Kern family. Melrose Inn manager George Kern created derby pie in the mid-1950s with help from his parents, Walter and Leaudra, and the dessert was such a hit that the family was soon baking the treat full-time. In fact, Mrs. Kern, being the crafty monopolist she was, copyrighted the name, and to this day, you can only get real ""Derby-Pie®"" through Kern's Kitchen, Inc. Not only that, but a man from New England once handed Leaudra a blank check for the recipe so that his daughter could make the pie at home. She refused.I E-mail to a friend . For more mental_floss articles, visit mentalfloss.com . Entire contents of this article copyright, Mental Floss LLC. All rights reserved.",0.79700685,159
1,"New York (CNN) -- The legendary New York restaurant Tavern on the Green will close its doors after serving a last supper and hosting a New Year's party. The iconic spot on the western edge of Central Park will undergo major renovations under a new operator and may even retain its famous name, but to many patrons, this is indisputably the end of an era. Claudia Myers and Wayne Knowles, a semi-retired couple visiting from Norfolk, Virginia, were saddened by the news and decided to treat themselves to one last Tavern dinner. ""I came here years ago and had good memories,"" Knowles said. ""It's the atmosphere and ambience"" Myers added. ""Everyone knows what Tavern on the Green is and where is it"" -- here, Myers paused -- ""except one cab driver. It's just a neat place. It has history and it's in the park."" Ed Brown and his wife, Judy, also were in town for the holidays from Plantation, Florida, and were aware of the restaurant's plans. ""It's my first and last time at eating at Tavern on the Green,"" Brown said. ""At least I can now say I ate there."" Rodney Shephard recently was making preparations for his last party, for 1,500 guests. It's nothing the restaurant's maitre d' for the past 23 years couldn't handle, but he wasn't looking forward to his last party on his last day of employment at the restaurant. ""I never thought this day would come"" said Shephard, 52. ""Not like this. Not like the money-making machine that this place is."" The restaurant served its first meal in 1936, when Mayor Fiorello La Guardia presided over its opening as the city and the country were trying to dig out from the Great Depression. The restaurant almost died in 1974 when the operator  shuttered the ""rustic little money-losing pub,"" as New York Times food writer Eric Asimov later described it. But Warner LeRoy immediately took over the Tavern's lease and invested $10 million. He added two rooms to the existing four and installed scores of copper and brass chandeliers, Tiffany-style stained glass, bull's-eye glass mirrors and ornate pastel-colored fixtures, and a 167-foot mural depicting Central Park. After its 1976 reopening, words like ""playful,"" ""dazzling"" and ""eclectic"" were used to describe the restaurant's ambience and the menu. ""It was an over-the-top whimsical place,"" said longtime publicist Shelley Clark. Warner Leroy's father, Mervyn LeRoy, was the producer of the ""Wizard of Oz,"" A black-and-white photograph hanging in the Tavern shows Warner as a child with Judy Garland on the set of the movie. Jennifer Oz LeRoy, in her recently published book ""Tavern on the Green 125 Recipes for Good Times,"" -- co-authored by her mother, Kay -- described the vision of the restaurant that her father wanted. ""When he walked into the courtyard of the run-down building, he imagined something wholly original and incredible: He would build a room in that space that would look like the inside of a wedding cake."" she recalled. ""He was a brilliant showman and a brilliant restaurateur. He was bigger than life."" said the Tavern's chief operating officer, Michael Desiderio. ""He thought dining is like a great show, and when the curtain goes up everything must be perfect."" Shephard, who started as a front desk manager, fondly recalled LeRoy and the sense of family that he brought to the establishment: ""It's like a second home. I consider the employees like your brothers and sisters, and now it's all going to be cut off."" The restaurant became the destination for anniversaries, birthdays and family affairs, It served more than 500,000 people a year, an average of 1,400 dinners a night. Tourists eagerly descended upon the eatery for the crab cakes, wedge salad, salmon and parmesan-crusted chicken. Food critics were not so thrilled. Andrew Knowlton, restaurant editor for Bon Appetit magazine, said the restaurant has never been the greatest venue for foodies. ""When you're serving 2,000 meals a deal, I don't care if you're [chef] Jean-Georges Vongerichten and Daniel Boulud, you just can't put out that much of a volume and have top quality food."" The LeRoy family was forced to file for bankruptcy in 2009 after losing a bidding war for to another proprietor, Dean Poll, who also owns the Boathouse Restaurant in Central Park. Once the restaurant closes, its contents will be auctioned off by Guernsey's auction house. As part of the 20-year license to operate the restaurant, Poll is expected to invest $25 million on renovations. While maintaining the Victorian historic features of the building, Poll's plan is to incorporate green building technology as well as replacing the kitchen and electrical and plumbing systems. The renovations, which are expected to take four years, will be conducted in phases so the restaurant can remain open. Attorney Barry LePatner, who represents Poll, said the new revitalized restaurant will become a popular destination for tourists and New Yorkers alike. ""The new incarnation of Tavern on the Green will integrate modern respect with an iconic location and a sensibility that will warm to New Yorkers"" LePatner said. ""We want more New Yorkers as well as tourists."" LePatner said that while the terms of the lease are still being negotiated with the city parks department and issues with labor unions are still unresolved, Poll's vision is to create a new era. ""The game plan is to have one of the biggest creative moments in the history of the city, and bring Tavern on the Green back to its original, enhanced luster."" One issue that is still left unresolved is the iconic name of the restaurant, which the current management estimates is valued at $19 million. The LeRoy family claims it trademarked the name in 1981. U.S. District Court Judge Miriam Goldman Cedarbaum is expected to make a ruling in January. In the meantime, LePatner said, the city has filed a trademark for ""Tavern in the Park"" but that Poll would like to retain the original name and that it should rest with the site. Warner LeRoy, who was fond of flamboyant bashes, probably would approve of the Tavern's plan to say farewell on New Year's Eve. Over the park, as fireworks light up the sky and as the last party-goers exit, they will gaze at the 750,000 tiny white light bulbs that envelop the restaurant and just hope the new owners remember to keep the lights on.",0.78534806,9356
2,"NEW YORK -- There's no shortage of diners in New York City, but one of its most beloved will soon be taking up residence in Alabama. The Cheyenne Diner, which opened in 1940 in New York City, shut its doors in April 2008. The Cheyenne Diner, which first opened in 1940, was split in two Monday night to begin its move on a pair of flatbed trucks some 860 miles to its new home near Birmingham. The dining experience at the Cheyenne was typical of many similar New York eateries, where more often than not, you're guaranteed a hearty meal at a comfortable price. After taking a seat in a roomy booth or even at the counter, you check out the flimsy paper placemat with innocuous historical information or a simplified map of the Greek Isles. A busboy places a glass of ice water on your table. Then it's time to break out the reading glasses and flex those muscles to heft the always lengthy menu. While it may take you several minutes to sift through it, take comfort in knowing that you may actually burn some calories by lifting this bible of comfort food. Unlike the sometimes stuffy pretense of a formal restaurant, the diner experience is generally simple, while the food offerings are diverse -- from apple pie to baked ziti and everything in between. While never known as a bastion for fine dining, the Cheyenne saw brighter days before it unceremoniously closed on a chilly Sunday in April 2008. Originally known as the Market Diner until its moniker was changed in 1986, the pre-assembled restaurant stood as a rare classic definition of free-standing diners. Its streamlined, railcar-inspired design boasts a reverse-channel illuminated neon sign. Horizontal and vertical stainless steel strips border the colorful enamel panels and wrap-around windows on its facade. Celebrities from Jerry Lewis to David Letterman entered through its curved entryway lined with glass blocks. But, like a beloved baseball team whose owner has tossed in the towel, the Cheyenne is moving to a new town for a new life in a new home. The owner of the diner, George Papas, wanted to change the flavor of the block and replace the eatery with a multilevel condo building. Enter preservationist Michael Perlman, a 26-year-old patron saint of sorts for unwanted diners. Perlman found out that the Cheyenne was facing demolition and began to look for a guardian angel to save it. He connected with Alabama businessman Joel Owens, head of the investment group NAIC, who saw the Cheyenne for sale on a Web site devoted to the preservation of New York City structures and fell in love with its ""gorgeous structure."" ""I like it better each time I see it,"" Owens said. ""The barrel roof. The exterior facades are second to none. I think it's the most beautiful diner in the world."" Owens and his business associate, Patti Miller, have a grand vision for the diner and eventually want to incorporate it as part of an entertainment and historic area outside of Birmingham. Once it's restored, which could take up to a year, the Cheyenne will become the first free-standing diner in Alabama, Owens said. A longtime collector of antique cars and Coca-Cola memorabilia, Owens is a firm believer in the lessons that can be learned from the past. ""If you think about what's wrong with today, in order to fix the problems of today, you've got to look back... [to] when it was better,"" Owens said. ""I think [the diner] is symbolic of the glory days. Technology and more money doesn't necessarily mean progress. We long for simpler times,"" he explained. ""These types of buildings can be an instrument for our youth to learn from the past. Teenagers need a clean environment for entertainment, a 'hang out.'"" The departure of the Cheyenne Diner brings back some bitter memories for aficionados of historic New York. The Moondance Diner encountered a similar fate in 2007, after it was put up for sale by developers who purchased the land it was sitting on and planned to build a hotel. That summer, a couple from Wyoming found the Moondance's sale notice on the American Diner Museum Web site. Perlman acted as a conduit there also, helping to broker the sale of the 1920s diner located in the SoHo section of Manhattan, which the couple planned to move to their home state. When news of the sale and move came out, the Pierces began to have some doubts. ""We're quiet people,"" said Cheryl Pierce, of La Barge, Wyoming. ""[But] the media response has been a blessing as people have shown a keen interest."" Pierce and her husband paid $7,500 for the Moondance and ultimately invested $40,000 to move it more than 2,100 miles to La Barge, where it became a popular site in the town of 600 residents with few other restaurants. The barrel-roofed diner reopened on January 12 this year, complete with its original floor and window frames. Customers can sit at the old-fashioned soda fountain or on the outdoor patio in the summer. The menu contains the traditional diner fare -- burgers, fries and milk shakes -- but also caters to the local palate, with chicken fried steaks, ribeye steaks and prime rib. ""Business has been exceptional. We've been able to hold our own,"" said Pierce. ""We get a lot of people who take a detour to visit us."" She noted that it's a lot of work, and a huge commitment, but said she and her husband ""have been blessed."" ""There's never going to be another Moondance Diner,"" she said. In response to critics who complain that historic pieces of New York City are being sold off, Pierce said that in the cases of old diners, ""to keep it alive, somewhere else is the best option, [rather] than seeing it demolished. We've run into New Yorkers who are appreciative that we brought it back to life."" Owens is hoping that will be the case with the Cheyenne, which was loved as a no-frills refuge for comfort food on Manhattan's desolate west side. But now it's served up its last order in New York. And that last order was to go.",0.76025426,7019
3,"MINNEAPOLIS, Minnesota (CNN) -- David and Christina Macfarlane always dreamed of opening a restaurant. And with David's background as a White House chef, they certainly have the in-house culinary ability. David and Christina Macfarlane in their Minneapolis restaurant, L'Ecosse. But they never imagined they'd be doing it in one of the toughest economic times ever, and they wondered if it would even be possible. ""The banks were like, 'You're opening a restaurant now?' "" Christina says. "" 'Yeah, we're opening a restaurant now.' "" David was born in Glasgow, Scotland, but moved to the United States with his family in his early teens and soon found his passion for the palate. Soon after high school, he joined the U.S. Navy, where he ultimately spent years cooking -- two of which were spent in the kitchen at 1600 Pennsylvania Avenue as a chef for President Clinton at the beginning of his first term in 1992. Looking at a picture of himself and the former president, David describes a favorite memory. ""He said that was the best meal he ever ate. I was pretty geeked about that.""  See more about that favorite meal » . But the Macfarlanes wanted more time as a family -- something not suited to David's high-profile job. They moved a number of times before settling down in the Minneapolis, Minnesota, suburbs where, most recently, David worked for Fusion Culinary -- until his position was eliminated, that is. Christina says that as dismayed as David was over the job loss, she saw it as ""a blessing."" ""I thought, 'Thank you, Lord! Thank you, Lord!' "" she says, adding that she saw it as the perfect opportunity to follow through with their dream. Now, despite the battered economy, the two stand behind the bar in their new restaurant, L'Ecosse, which, incidentally, is French for ""Scotland."" However, they have a slightly different take on the menu than perhaps they would have had if times were perkier. ""We went to over a dozen restaurants looking at menus, pricepoints, [and] realizing the struggles in the economy,"" Christina recalls. The two concluded that while people are still eating out, they aren't seeking ""fancy"" food -- in other words, they weren't seeking the type of fare one might typically associate with state dinners at the White House. David says that's all a misconception anyway. ""Comfort food,"" he says. ""That's what the president wanted most."" Some of the president's favorite foods, David says were nachos and salsa, tuna sandwiches, or just warm milk and cookies. ""[President Clinton] wasn't looking for any of the fancy frou-frou stuff. We did that for state dinners or we did that for dignitaries that would come in, but ... at lunchtime when the president would be in the Oval Office by himself, [he'd say] 'Lemme have a tuna sandwich.' "" At L'Ecosse, tuna and warm cookies are on the menu. Keeping with his Scottish upbringing, David's menu also is largely UK-centric: meat pies and fish and chips are two of the specialties. He does it all with fresh, local ingredients and says he can keep prices down because he does a lot of the work himself and with the help of a very minimal staff.  Watch the chef talk about keeping it simple » . Everything on the breakfast and lunch menus is priced under $10, and the two say that when they expand to a full dinner menu once their liquor license is approved, they want to keep prices similarly low. ""The reason we did that was so nobody had sticker shock,"" David says. ""They're very good items, but they're also inexpensive items and you're not going to break the bank."" ""If you want to come in and get Bill Clinton's favorite, it doesn't have to be $15 during the day. And that's what we want people to understand -- we understand where you're at."" As Christina puts it, ""You are going to get great food that your mother used to make for you."" And, ideally, the bill won't send you into debt.",0.7516539,2621
